{
  "schemaVersion": "2.0",
  "id": "roland_aira_patch_spec",
  "displayName": "Roland AIRA Modular — Patch Spec (Bitrazer, Torcido, Demora, Scooper)",
  "description": "Complete reverse-engineered specification for AIRA Modular patches: SysEx protocol (RQ1/DT1), main module, 6 sub-module slots, 31-submodule catalog with jack maps, virtual cable operations and cable-condition bitmasks. Shared by the AIRA patch editor and ABDBankManager.",
  "deviceType": "AUTOMATED_SYSEX",
  "brand": "Roland",
  "brandLogo": "brands/roland-logo.svg",
  "modelImage": "models/roland-airamodular.webp",
  "source": "Unofficial MIDI Implementation v1.2 by mugenkidou (reverse engineering). Verify write behaviour against hardware before production use.",
  "notes": [
    "The 4 AIRA Modular devices share the same internal DSP engine and the same patch format; only the Model ID byte differs.",
    "The shared engine has 6 slots; any of the 31 submodules can be loaded into any slot on any of the 4 devices.",
    "Type IDs 0x0F (MIDI CLOCK TO GATE) and 0x10 (SHORT DELAY) are inferred from the In/Out tables (the official param table skips 15 and 16); 0x10 out2 for NOISE is assumed (README lists OUT 1 twice). Verify against hardware."
  ],
  "midiIdentification": {
    "manufacturer": "Roland",
    "manufacturerIdHex": "41",
    "deviceIdHex": "10",
    "modelIdBytes": "00 00 00 <modelId>",
    "universalIdentityRequest": "F0 7E 10 06 01 F7"
  },
  "devices": {
    "bitrazer": {
      "modelIdHex": "15",
      "displayName": "BITRAZER",
      "mainParameters": ["LPF/HPF", "BYPASS", "SAMPLE RATE", "FILTER CUTOFF", "RATE DOWN", "RESONANCE", "SAMPLE RATE LEVEL", "FILTER CUTOFF LEVEL", "RATE DOWN LEVEL", "RESONANCE LEVEL"]
    },
    "torcido": {
      "modelIdHex": "17",
      "displayName": "TORCIDO",
      "mainParameters": ["LO BOOST", "BYPASS", "DIST", "TONE", "TUBE WARM", "DRY/WET", "DIST LEVEL", "TONE LEVEL", "TUBE WARM LEVEL", "DRY/WET LEVEL"]
    },
    "demora": {
      "modelIdHex": "16",
      "displayName": "DEMORA",
      "mainParameters": ["HOLD", "BYPASS", "TIME", "FEEDBACK", "WIDTH", "DRY/WET", "TIME LEVEL", "FEEDBACK LEVEL", "WIDTH LEVEL", "DRY/WET LEVEL"]
    },
    "scooper": {
      "modelIdHex": "18",
      "displayName": "SCOOPER",
      "mainParameters": ["SYNC TRIG", "SCATTER", "SCATTER DEPTH", "SCATTER TYPE", "PITCH", "FILTER", "SCATTER DEPTH LEVEL", "SCATTER TYPE LEVEL", "PITCH LEVEL", "FILTER LEVEL"]
    },
    "_note": "Model ID order as listed in the mugenkidou README (15H-18H = BITRAZER, DEMORA, TORCIDO, SCOOPER). Verify each device on hardware before production use."
  },
  "protocol": {
    "rq1": {
      "name": "Data Request 1",
      "bytes": ["F0", "41", "10", "00", "00", "00", "<modelId>", "11", "aa", "bb", "cc", "dd", "ss", "tt", "uu", "vv", "<checksum>", "F7"],
      "addressBytes": ["aa", "bb", "cc", "dd"],
      "sizeBytes": ["ss", "tt", "uu", "vv"]
    },
    "dt1": {
      "name": "Data Set 1",
      "bytes": ["F0", "41", "10", "00", "00", "00", "<modelId>", "12", "aa", "bb", "cc", "dd", "<data...>", "<checksum>", "F7"],
      "addressBytes": ["aa", "bb", "cc", "dd"]
    },
    "checksum": {
      "algorithm": "Roland 7-bit checksum",
      "scope": "sum of bytes from first address byte through last data byte",
      "formula": "checksum = (0x80 - (sum & 0x7F)) & 0x7F"
    }
  },
  "mainModule": {
    "addressBase": "10 00 00",
    "parameterCount": 10,
    "parameters": [
      { "addressHex": "01", "name": "PARAMETER 1" },
      { "addressHex": "02", "name": "PARAMETER 2" },
      { "addressHex": "03", "name": "PARAMETER 3" },
      { "addressHex": "04", "name": "PARAMETER 4" },
      { "addressHex": "05", "name": "PARAMETER 5" },
      { "addressHex": "06", "name": "PARAMETER 6" },
      { "addressHex": "07", "name": "PARAMETER 7" },
      { "addressHex": "08", "name": "PARAMETER 8" },
      { "addressHex": "09", "name": "PARAMETER 9" },
      { "addressHex": "0A", "name": "PARAMETER 10" }
    ],
    "parameterNamesByDevice": {
      "bitrazer": ["LPF/HPF", "BYPASS", "SAMPLE RATE", "FILTER CUTOFF", "RATE DOWN", "RESONANCE", "SAMPLE RATE LEVEL", "FILTER CUTOFF LEVEL", "RATE DOWN LEVEL", "RESONANCE LEVEL"],
      "torcido": ["LO BOOST", "BYPASS", "DIST", "TONE", "TUBE WARM", "DRY/WET", "DIST LEVEL", "TONE LEVEL", "TUBE WARM LEVEL", "DRY/WET LEVEL"],
      "demora": ["HOLD", "BYPASS", "TIME", "FEEDBACK", "WIDTH", "DRY/WET", "TIME LEVEL", "FEEDBACK LEVEL", "WIDTH LEVEL", "DRY/WET LEVEL"],
      "scooper": ["SYNC TRIG", "SCATTER", "SCATTER DEPTH", "SCATTER TYPE", "PITCH", "FILTER", "SCATTER DEPTH LEVEL", "SCATTER TYPE LEVEL", "PITCH LEVEL", "FILTER LEVEL"]
    }
  },
  "slots": [
    { "index": 1, "typeAddress": "10 10 00 00", "paramAddresses": ["10 10 00 01", "10 10 00 02", "10 10 00 03", "10 10 00 04"] },
    { "index": 2, "typeAddress": "10 10 00 05", "paramAddresses": ["10 10 00 06", "10 10 00 07", "10 10 00 08", "10 10 00 09"] },
    { "index": 3, "typeAddress": "10 10 00 0A", "paramAddresses": ["10 10 00 0B", "10 10 00 0C", "10 10 00 0D", "10 10 00 0E"] },
    { "index": 4, "typeAddress": "10 10 00 0F", "paramAddresses": ["10 10 00 10", "10 10 00 11", "10 10 00 12", "10 10 00 13"] },
    { "index": 5, "typeAddress": "10 10 00 14", "paramAddresses": ["10 10 00 15", "10 10 00 16", "10 10 00 17", "10 10 00 18"] },
    { "index": 6, "typeAddress": "10 10 00 19", "paramAddresses": ["10 10 00 1A", "10 10 00 1B", "10 10 00 1C", "10 10 00 1D"] }
  ],
  "submodules": [
    { "typeIdHex": "00", "id": "empty", "name": "EMPTY", "params": [null, null, null, null], "ins": [null, null, null, null], "outs": [null, null] },
    { "typeIdHex": "01", "id": "lfo", "name": "LFO", "params": ["WAVE", "RATE", "MOD IN LEVEL", "OUTPUT LEVEL"], "ins": ["RATE", "SYNC TRG IN", "WAVE", null], "outs": ["LFO OUT", "LFO INVERSE OUT"] },
    { "typeIdHex": "02", "id": "adsr", "name": "ADSR", "params": ["ATTACK", "DECAY", "SUSTAIN", "RELEASE"], "ins": ["GATE IN", "ATTACK", "DECAY", "RELEASE"], "outs": ["ENVELOPE OUT", "ENVELOPE INVERSE OUT"] },
    { "typeIdHex": "03", "id": "noise", "name": "NOISE", "params": ["TYPE 1", "TYPE 2", "LEVEL 1", "LEVEL 2"], "ins": ["TYPE 1", "TYPE 2", "LEVEL 1", "LEVEL 2"], "outs": ["NOISE OUT 1", "NOISE OUT 2 (assumed)"] },
    { "typeIdHex": "04", "id": "sample_and_hold", "name": "SAMPLE & HOLD", "params": ["RATE", "MOD IN LEVEL", "TRIGGER IN SW", null], "ins": ["AUDIO IN 1", "AUDIO IN 2", "MOD IN", "TRIGGER IN"], "outs": ["S&H OUT 1", "S&H OUT 2"] },
    { "typeIdHex": "05", "id": "ring_mod", "name": "RING MOD", "params": ["MOD SW", null, null, null], "ins": ["AUDIO IN", "AUDIO MOD IN", "MOD SW TRIGGER IN", null], "outs": ["RING MOD OUT", null] },
    { "typeIdHex": "06", "id": "filter_6db", "name": "FILTER 6dB", "params": ["TYPE", "CUTOFF", "MOD IN", "RESONANCE"], "ins": ["AUDIO IN 1", "AUDIO IN 2", "MOD IN", "RESONANCE IN"], "outs": ["FILTER OUT 1", "FILTER OUT 2"] },
    { "typeIdHex": "07", "id": "filter_12db", "name": "FILTER 12dB", "params": ["TYPE", "CUTOFF", "MOD IN", "RESONANCE"], "ins": ["AUDIO IN 1", "AUDIO IN 2", "MOD IN", "RESONANCE IN"], "outs": ["FILTER OUT 1", "FILTER OUT 2"] },
    { "typeIdHex": "08", "id": "tone", "name": "TONE", "params": ["TYPE", "FREQUENCY", "LEVEL", null], "ins": ["AUDIO IN 1", "AUDIO IN 2", "FREQUENCY IN", "LEVEL IN"], "outs": ["TONE OUT 1", "TONE OUT 2"] },
    { "typeIdHex": "09", "id": "amp", "name": "AMP", "params": ["AMP 1", "AMP 2", "LEVEL 1", "LEVEL 2"], "ins": ["AMP IN 1", "AMP IN 2", "AUDIO/CV IN 1", "AUDIO/CV IN 2"], "outs": ["AMP OUT 1", "AMP OUT 2"] },
    { "typeIdHex": "0A", "id": "mixer", "name": "MIXER", "params": ["LEVEL 1", "LEVEL 2", "LEVEL 3", "LEVEL 4"], "ins": ["AUDIO IN 1", "AUDIO IN 2", "AUDIO IN 3", "AUDIO IN 4"], "outs": ["MIX OUT", null] },
    { "typeIdHex": "0B", "id": "stereo_mixer", "name": "STEREO MIXER", "params": ["LEVEL 1", "LEVEL 2", "PAN 1", "PAN 2"], "ins": ["AUDIO IN 1-L", "AUDIO IN 1-R", "AUDIO IN 2-L", "AUDIO IN 2-R"], "outs": ["MIX OUT L", "MIX OUT R"] },
    { "typeIdHex": "0C", "id": "curve_conv", "name": "CURVE CONV", "params": ["CURVE TYPE", "REVERSE SW", null, null], "ins": ["CV IN 1", "CV IN 2", "CURVE TYPE IN", null], "outs": ["CONVERT OUT 1", "CONVERT OUT 2"] },
    { "typeIdHex": "0D", "id": "gate_divider", "name": "GATE DIVIDER", "params": ["MULTIPLE/DIVIDE", null, null, null], "ins": ["TRIGGER IN", "MULTIPLE/DIVIDE IN", null, null], "outs": ["GATE OUT", null] },
    { "typeIdHex": "0E", "id": "trig_to_cv_delay_time", "name": "TRIG TO CV DELAY TIME", "params": ["MULTIPLE/DIVIDE", null, null, null], "ins": ["TRIGGER IN", "MULTIPLE/DIVIDE IN", null, null], "outs": ["DELAY TIME CV", null] },
    { "typeIdHex": "0F", "id": "midi_clock_to_gate", "name": "MIDI CLOCK TO GATE", "inferred": true, "params": ["MULTIPLE/DIVIDE", null, null, null], "ins": ["MULTIPLE/DIVIDE IN", null, null, null], "outs": ["CLOCK GATE OUT", "START/STOP GATE OUT"] },
    { "typeIdHex": "10", "id": "short_delay", "name": "SHORT DELAY", "inferred": true, "params": ["DELAY TIME", "FEEDBACK", "DRY/WET", null], "ins": ["AUDIO IN", "DELAY TIME IN", "FEEDBACK IN", "DRY/WET IN"], "outs": ["DELAY OUT", null] },
    { "typeIdHex": "11", "id": "tube_clip", "name": "TUBE CLIP", "params": ["GAIN", "OUTPUT LEVEL", null, null], "ins": ["AUDIO IN 1", "AUDIO IN 2", "GAIN IN", "OUTPUT LEVEL IN"], "outs": ["CLIP OUT 1", "CLIP OUT 2"] },
    { "typeIdHex": "12", "id": "compressor", "name": "COMPRESSOR", "params": ["THRESHOLD", "RATIO", "ATTACK", "RELEASE"], "ins": ["AUDIO IN 1", "AUDIO IN 2", "THRESHOLD IN", null], "outs": ["COMPRESSION OUT 1", "COMPRESSION OUT 2"] },
    { "typeIdHex": "13", "id": "noise_gate", "name": "NOISE GATE", "params": ["THRESHOLD", "DECAY", null, null], "ins": ["AUDIO IN 1", "AUDIO IN 2", "THRESHOLD IN", "DECAY IN"], "outs": ["NOISE GATE OUT 1", "NOISE GATE OUT 2"] },